{
  "$schema": "https://mash.axsys.dev/schema/catalogue-recipe-1.0.0.json",
  "version": "1.0.0",
  "name": "mash",
  "componentContract": "1.0.0",
  "layoutContract": "2.0.0",
  "layoutVocabulary": {
    "orientations": [
      "block",
      "inline",
      "depth"
    ],
    "groups": [
      "none",
      "contents",
      "flow",
      "grid",
      "overlay"
    ],
    "alignments": [
      "leading",
      "center",
      "trailing",
      "stretch",
      "baseline"
    ],
    "distributions": [
      "leading",
      "center",
      "trailing",
      "between",
      "around",
      "evenly",
      "stretch"
    ],
    "wraps": [
      "none",
      "forward",
      "reverse"
    ],
    "overflow": [
      "visible",
      "clip",
      "hidden",
      "auto",
      "scroll"
    ],
    "anchors": [
      "flow",
      "relative",
      "absolute",
      "fixed",
      "sticky"
    ],
    "dimensions": [
      "min",
      "ideal",
      "max"
    ],
    "edges": [
      "blockStart",
      "blockEnd",
      "inlineStart",
      "inlineEnd"
    ],
    "valueKinds": [
      "token",
      "literal",
      "expression",
      "inherited"
    ]
  },
  "presentationContract": "1.0.0",
  "presentationVocabulary": {
    "aspects": [
      "surface",
      "content",
      "edge",
      "focus",
      "elevation",
      "type",
      "motion",
      "interaction",
      "media",
      "generated",
      "layout"
    ],
    "eventIntents": [
      "request",
      "report"
    ],
    "relationKinds": [
      "requests",
      "reports"
    ],
    "conditionKinds": [
      "node",
      "interaction",
      "environment",
      "context",
      "renderer"
    ]
  },
  "source": "./mash.css",
  "nodes": {
    "mash://sh-limb/node/label": {
      "tokens": [
        "layout.dimension.zero"
      ],
      "coverage": "direct",
      "layout": "constrained"
    },
    "mash://sh-limb/node/root": {
      "tokens": [
        "layout.dimension.zero",
        "space.controlGap",
        "space.controlInline"
      ],
      "coverage": "direct",
      "layout": "constrained"
    },
    "mash://sh-limb/node/value": {
      "tokens": [
        "layout.dimension.zero"
      ],
      "coverage": "direct",
      "layout": "constrained"
    },
    "mash://sh-locator/node/locator": {
      "tokens": [
        "border.hairline",
        "color.border",
        "color.surfaceSunken",
        "color.textMuted",
        "space.controlBlock",
        "space.controlInline",
        "type.code.fontFamily",
        "type.code.fontSize",
        "type.code.fontWeight",
        "type.code.lineHeight"
      ],
      "coverage": "direct",
      "layout": "constrained"
    },
    "mash://sh-locator/node/root": {
      "tokens": [],
      "coverage": "direct",
      "layout": "constrained"
    },
    "mash://sh-myth/node/actions": {
      "tokens": [
        "layout.dimension.zero"
      ],
      "coverage": "direct",
      "layout": "constrained"
    },
    "mash://sh-myth/node/content": {
      "tokens": [
        "space.containerBlock",
        "space.containerInline"
      ],
      "coverage": "direct",
      "layout": "constrained"
    },
    "mash://sh-myth/node/header": {
      "tokens": [
        "layout.dimension.zero",
        "space.containerBlock",
        "space.containerGap",
        "space.containerInline"
      ],
      "coverage": "direct",
      "layout": "constrained"
    },
    "mash://sh-myth/node/identity": {
      "tokens": [
        "layout.dimension.zero",
        "space.controlGap"
      ],
      "coverage": "direct",
      "layout": "constrained"
    },
    "mash://sh-myth/node/kind": {
      "tokens": [
        "color.action",
        "color.onAction",
        "layout.dimension.zero",
        "radius.pill",
        "space.controlBlockSmall",
        "space.controlInlineSmall",
        "type.labelSmall.fontFamily",
        "type.labelSmall.fontSize",
        "type.labelSmall.fontWeight",
        "type.labelSmall.lineHeight"
      ],
      "coverage": "direct",
      "layout": "constrained"
    },
    "mash://sh-myth/node/limbs": {
      "tokens": [
        "space.controlGap"
      ],
      "coverage": "direct",
      "layout": "constrained"
    },
    "mash://sh-myth/node/path": {
      "tokens": [
        "color.textMuted",
        "layout.dimension.zero",
        "type.code.fontFamily",
        "type.code.fontSize",
        "type.code.fontWeight",
        "type.code.lineHeight"
      ],
      "coverage": "direct",
      "layout": "constrained"
    },
    "mash://sh-myth/node/root": {
      "tokens": [
        "border.hairline",
        "color.border",
        "color.surface",
        "color.text",
        "layout.dimension.record",
        "radius.container",
        "type.body.fontFamily",
        "type.body.fontSize",
        "type.body.fontWeight",
        "type.body.lineHeight"
      ],
      "coverage": "direct",
      "layout": "constrained"
    },
    "mash://sh-myth/node/title": {
      "tokens": [
        "color.text",
        "layout.dimension.zero",
        "type.heading.fontFamily",
        "type.heading.fontSize",
        "type.heading.fontWeight",
        "type.heading.lineHeight"
      ],
      "coverage": "direct",
      "layout": "constrained"
    },
    "mash://sh-pail/node/root": {
      "tokens": [
        "layout.dimension.zero"
      ],
      "coverage": "direct",
      "layout": "constrained"
    },
    "mash://sh-pail/node/value": {
      "tokens": [
        "color.text",
        "type.body.fontFamily",
        "type.body.fontSize",
        "type.body.fontWeight",
        "type.body.lineHeight"
      ],
      "coverage": "direct",
      "layout": "unconstrained"
    },
    "mash://sh-slot/node/label": {
      "tokens": [
        "color.textMuted",
        "type.code.fontFamily",
        "type.code.fontSize",
        "type.code.fontWeight",
        "type.code.lineHeight"
      ],
      "coverage": "direct",
      "layout": "unconstrained"
    },
    "mash://sh-slot/node/root": {
      "tokens": [
        "layout.dimension.zero"
      ],
      "coverage": "direct",
      "layout": "constrained"
    },
    "mash://sh-triptych/node/inspector": {
      "tokens": [
        "border.hairline",
        "color.border",
        "color.surfaceSunken",
        "layout.dimension.zero"
      ],
      "coverage": "direct",
      "layout": "constrained"
    },
    "mash://sh-triptych/node/inspector-content": {
      "tokens": [],
      "coverage": "contract-only",
      "layout": "unconstrained"
    },
    "mash://sh-triptych/node/inspector-locator": {
      "tokens": [
        "border.hairline",
        "color.border",
        "space.controlBlock"
      ],
      "coverage": "direct",
      "layout": "constrained"
    },
    "mash://sh-triptych/node/inspector-open": {
      "tokens": [],
      "coverage": "contract-only",
      "layout": "unconstrained"
    },
    "mash://sh-triptych/node/inspector-scroller": {
      "tokens": [
        "layout.dimension.zero"
      ],
      "coverage": "direct",
      "layout": "constrained"
    },
    "mash://sh-triptych/node/inspector-viewport": {
      "tokens": [],
      "coverage": "direct",
      "layout": "constrained"
    },
    "mash://sh-triptych/node/main": {
      "tokens": [
        "layout.dimension.zero"
      ],
      "coverage": "direct",
      "layout": "constrained"
    },
    "mash://sh-triptych/node/main-content": {
      "tokens": [],
      "coverage": "contract-only",
      "layout": "unconstrained"
    },
    "mash://sh-triptych/node/main-locator": {
      "tokens": [
        "border.hairline",
        "color.border",
        "space.controlBlock"
      ],
      "coverage": "direct",
      "layout": "constrained"
    },
    "mash://sh-triptych/node/main-scroller": {
      "tokens": [
        "layout.dimension.zero"
      ],
      "coverage": "direct",
      "layout": "constrained"
    },
    "mash://sh-triptych/node/main-viewport": {
      "tokens": [],
      "coverage": "direct",
      "layout": "constrained"
    },
    "mash://sh-triptych/node/navigate": {
      "tokens": [
        "border.hairline",
        "color.border",
        "space.containerBlock",
        "space.controlBlock"
      ],
      "coverage": "direct",
      "layout": "constrained"
    },
    "mash://sh-triptych/node/shell": {
      "tokens": [
        "color.canvas",
        "color.text",
        "layout.dimension.compact",
        "layout.dimension.inspector",
        "layout.dimension.panel",
        "layout.dimension.supporting",
        "layout.dimension.zero"
      ],
      "coverage": "direct",
      "layout": "constrained"
    },
    "mash://sh-triptych/node/sidebar": {
      "tokens": [
        "border.hairline",
        "color.border",
        "color.surfaceSunken",
        "layout.dimension.zero"
      ],
      "coverage": "direct",
      "layout": "constrained"
    },
    "mash://sh-triptych/node/sidebar-content": {
      "tokens": [],
      "coverage": "contract-only",
      "layout": "unconstrained"
    },
    "mash://sh-triptych/node/sidebar-scroller": {
      "tokens": [
        "layout.dimension.zero"
      ],
      "coverage": "direct",
      "layout": "constrained"
    },
    "mash://sh-triptych/node/sidebar-viewport": {
      "tokens": [],
      "coverage": "direct",
      "layout": "constrained"
    },
    "mash://shrine-confirm/node/actions": {
      "tokens": [
        "space.controlGap"
      ],
      "coverage": "direct",
      "layout": "constrained"
    },
    "mash://shrine-confirm/node/cancel": {
      "tokens": [
        "color.neutral",
        "color.neutralHover",
        "color.neutralPressed",
        "color.text",
        "space.controlBlock",
        "space.controlInline",
        "type.label.fontSize",
        "type.label.fontWeight",
        "type.label.lineHeight"
      ],
      "coverage": "direct",
      "layout": "constrained"
    },
    "mash://shrine-confirm/node/cancel-control": {
      "tokens": [
        "border.focusRing",